{
  "DocumentType": "Invoice",
  "InvoiceID": "INV-SINGLE-2026",
  "IssueDate": "2026-08-22",
  "OrderID": "ORDER-SINGLE",
  "DeliveryNoteID": "DN-SINGLE",
  "LocalCurrencyCode": "EUR",
  "SupplierParty": {
    "PartyName": "Valid Supplier s.r.o.",
    "CompanyTaxID": "2026000001",
    "CompanyVATID": "SK2026000001",
    "CompanyRegisterID": "50123456",
    "PostalAddress": {
      "StreetName": "Testovacia",
      "BuildingNumber": "12",
      "CityName": "Žilina",
      "PostalZone": "010 01",
      "Country": "SVK"
    }
  },
  "CustomerParty": {
    "PartyName": "Valid Customer a.s.",
    "CompanyTaxID": "2026000002",
    "CompanyVATID": "SK2026000002",
    "CompanyRegisterID": "50987654"
  },
  "SingleInvoiceLine": {
    "OrderLineID": "OL-1",
    "DeliveryNoteLineID": "DL-1",
    "ItemEANCode": "8580000000001",
    "InvoicedQuantity": "2.5"
  },
  "TaxCategorySummaries": {
    "TaxCategorySummary": [
      {
        "ClassifiedTaxCategory": "0.23",
        "TaxExclusiveAmount": "30.85",
        "TaxAmount": "7.1",
        "AlreadyClaimedTaxExclusiveAmount": "0",
        "AlreadyClaimedTaxAmount": "0"
      }
    ]
  },
  "MonetarySummary": {
    "PayableRoundingAmount": "-0.01",
    "PaidDepositsAmount": "1"
  },
  "PaymentMeans": "cashOnDelivery"
}
